[
  {
    "category": "meta_node",
    "id": "meta_w_01",
    "schema_version": 1,
    "name_key": "META_W_01_NAME",
    "description_key": "META_W_01_DESC",
    "availability": [
      "LAUNCH",
      "EXPANSION"
    ],
    "tags": [
      "launch",
      "hub"
    ],
    "compatibility": {},
    "effects": {},
    "node_id": "W-01",
    "branch": "W",
    "cost": {
      "chronos_shards": 5,
      "existential_imprints": 0
    },
    "prerequisites": [],
    "meta_effects": [
      {
        "kind": "stat_bonus",
        "stat": "max_hp",
        "magnitude": 0.02
      }
    ]
  },
  {
    "category": "meta_node",
    "id": "meta_w_02",
    "schema_version": 1,
    "name_key": "META_W_02_NAME",
    "description_key": "META_W_02_DESC",
    "availability": [
      "LAUNCH",
      "EXPANSION"
    ],
    "tags": [
      "launch",
      "hub"
    ],
    "compatibility": {},
    "effects": {},
    "node_id": "W-02",
    "branch": "W",
    "cost": {
      "chronos_shards": 10,
      "existential_imprints": 0
    },
    "prerequisites": [
      "W-01"
    ],
    "meta_effects": [
      {
        "kind": "stat_bonus",
        "stat": "max_hp",
        "magnitude": 0.01
      }
    ]
  },
  {
    "category": "meta_node",
    "id": "meta_w_03",
    "schema_version": 1,
    "name_key": "META_W_03_NAME",
    "description_key": "META_W_03_DESC",
    "availability": [
      "LAUNCH",
      "EXPANSION"
    ],
    "tags": [
      "launch",
      "hub"
    ],
    "compatibility": {},
    "effects": {},
    "node_id": "W-03",
    "branch": "W",
    "cost": {
      "chronos_shards": 20,
      "existential_imprints": 0
    },
    "prerequisites": [
      "W-02"
    ],
    "meta_effects": [
      {
        "kind": "stat_bonus",
        "stat": "max_hp",
        "magnitude": 0.02
      }
    ]
  },
  {
    "category": "meta_node",
    "id": "meta_w_04",
    "schema_version": 1,
    "name_key": "META_W_04_NAME",
    "description_key": "META_W_04_DESC",
    "availability": [
      "LAUNCH",
      "EXPANSION"
    ],
    "tags": [
      "launch",
      "hub"
    ],
    "compatibility": {},
    "effects": {},
    "node_id": "W-04",
    "branch": "W",
    "cost": {
      "chronos_shards": 8,
      "existential_imprints": 0
    },
    "prerequisites": [
      "W-01"
    ],
    "meta_effects": [
      {
        "kind": "stat_bonus",
        "stat": "entrance_healing",
        "magnitude": 0.02
      }
    ]
  },
  {
    "category": "meta_node",
    "id": "meta_w_05",
    "schema_version": 1,
    "name_key": "META_W_05_NAME",
    "description_key": "META_W_05_DESC",
    "availability": [
      "LAUNCH",
      "EXPANSION"
    ],
    "tags": [
      "launch",
      "hub"
    ],
    "compatibility": {},
    "effects": {},
    "node_id": "W-05",
    "branch": "W",
    "cost": {
      "chronos_shards": 15,
      "existential_imprints": 0
    },
    "prerequisites": [
      "W-04"
    ],
    "meta_effects": [
      {
        "kind": "stat_bonus",
        "stat": "void_reduction",
        "magnitude": 0.02
      }
    ]
  },
  {
    "category": "meta_node",
    "id": "meta_w_06",
    "schema_version": 1,
    "name_key": "META_W_06_NAME",
    "description_key": "META_W_06_DESC",
    "availability": [
      "LAUNCH",
      "EXPANSION"
    ],
    "tags": [
      "launch",
      "hub"
    ],
    "compatibility": {},
    "effects": {},
    "node_id": "W-06",
    "branch": "W",
    "cost": {
      "chronos_shards": 30,
      "existential_imprints": 0
    },
    "prerequisites": [
      "W-03"
    ],
    "meta_effects": [
      {
        "kind": "option",
        "option_id": "safe_training_reset"
      },
      {
        "kind": "option",
        "option_id": "death_analysis"
      }
    ]
  },
  {
    "category": "meta_node",
    "id": "meta_w_07",
    "schema_version": 1,
    "name_key": "META_W_07_NAME",
    "description_key": "META_W_07_DESC",
    "availability": [
      "LAUNCH",
      "EXPANSION"
    ],
    "tags": [
      "launch",
      "hub"
    ],
    "compatibility": {},
    "effects": {},
    "node_id": "W-07",
    "branch": "W",
    "cost": {
      "chronos_shards": 10,
      "existential_imprints": 0
    },
    "prerequisites": [],
    "meta_effects": [
      {
        "kind": "soul_retention",
        "value": 0.5
      }
    ]
  },
  {
    "category": "meta_node",
    "id": "meta_w_08",
    "schema_version": 1,
    "name_key": "META_W_08_NAME",
    "description_key": "META_W_08_DESC",
    "availability": [
      "LAUNCH",
      "EXPANSION"
    ],
    "tags": [
      "launch",
      "hub"
    ],
    "compatibility": {},
    "effects": {},
    "node_id": "W-08",
    "branch": "W",
    "cost": {
      "chronos_shards": 20,
      "existential_imprints": 0
    },
    "prerequisites": [
      "W-07"
    ],
    "meta_effects": [
      {
        "kind": "soul_retention",
        "value": 0.7
      }
    ]
  },
  {
    "category": "meta_node",
    "id": "meta_w_09",
    "schema_version": 1,
    "name_key": "META_W_09_NAME",
    "description_key": "META_W_09_DESC",
    "availability": [
      "LAUNCH",
      "EXPANSION"
    ],
    "tags": [
      "launch",
      "hub"
    ],
    "compatibility": {},
    "effects": {},
    "node_id": "W-09",
    "branch": "W",
    "cost": {
      "chronos_shards": 5,
      "existential_imprints": 0
    },
    "prerequisites": [
      "W-05"
    ],
    "meta_effects": [
      {
        "kind": "option",
        "option_id": "free_hub_rest"
      }
    ]
  },
  {
    "category": "meta_node",
    "id": "meta_w_10",
    "schema_version": 1,
    "name_key": "META_W_10_NAME",
    "description_key": "META_W_10_DESC",
    "availability": [
      "LAUNCH",
      "EXPANSION"
    ],
    "tags": [
      "launch",
      "hub"
    ],
    "compatibility": {},
    "effects": {},
    "node_id": "W-10",
    "branch": "W",
    "cost": {
      "chronos_shards": 25,
      "existential_imprints": 0
    },
    "prerequisites": [
      "W-06"
    ],
    "meta_effects": [
      {
        "kind": "option",
        "option_id": "next_room_content_preview"
      }
    ]
  },
  {
    "category": "meta_node",
    "id": "meta_c_01",
    "schema_version": 1,
    "name_key": "META_C_01_NAME",
    "description_key": "META_C_01_DESC",
    "availability": [
      "LAUNCH",
      "EXPANSION"
    ],
    "tags": [
      "launch",
      "hub"
    ],
    "compatibility": {},
    "effects": {},
    "node_id": "C-01",
    "branch": "C",
    "cost": {
      "chronos_shards": 5,
      "existential_imprints": 0
    },
    "prerequisites": [],
    "meta_effects": [
      {
        "kind": "stat_bonus",
        "stat": "attack",
        "magnitude": 0.02
      }
    ]
  },
  {
    "category": "meta_node",
    "id": "meta_c_02",
    "schema_version": 1,
    "name_key": "META_C_02_NAME",
    "description_key": "META_C_02_DESC",
    "availability": [
      "LAUNCH",
      "EXPANSION"
    ],
    "tags": [
      "launch",
      "hub"
    ],
    "compatibility": {},
    "effects": {},
    "node_id": "C-02",
    "branch": "C",
    "cost": {
      "chronos_shards": 12,
      "existential_imprints": 0
    },
    "prerequisites": [
      "C-01"
    ],
    "meta_effects": [
      {
        "kind": "stat_bonus",
        "stat": "attack",
        "magnitude": 0.01
      }
    ]
  },
  {
    "category": "meta_node",
    "id": "meta_c_03",
    "schema_version": 1,
    "name_key": "META_C_03_NAME",
    "description_key": "META_C_03_DESC",
    "availability": [
      "LAUNCH",
      "EXPANSION"
    ],
    "tags": [
      "launch",
      "hub"
    ],
    "compatibility": {},
    "effects": {},
    "node_id": "C-03",
    "branch": "C",
    "cost": {
      "chronos_shards": 25,
      "existential_imprints": 0
    },
    "prerequisites": [
      "C-02"
    ],
    "meta_effects": [
      {
        "kind": "option",
        "option_id": "archetype_shortlists"
      }
    ]
  },
  {
    "category": "meta_node",
    "id": "meta_c_04",
    "schema_version": 1,
    "name_key": "META_C_04_NAME",
    "description_key": "META_C_04_DESC",
    "availability": [
      "LAUNCH",
      "EXPANSION"
    ],
    "tags": [
      "launch",
      "hub"
    ],
    "compatibility": {},
    "effects": {},
    "node_id": "C-04",
    "branch": "C",
    "cost": {
      "chronos_shards": 8,
      "existential_imprints": 0
    },
    "prerequisites": [],
    "meta_effects": [
      {
        "kind": "stat_bonus",
        "stat": "attack_speed",
        "magnitude": 0.01
      }
    ]
  },
  {
    "category": "meta_node",
    "id": "meta_c_05",
    "schema_version": 1,
    "name_key": "META_C_05_NAME",
    "description_key": "META_C_05_DESC",
    "availability": [
      "LAUNCH",
      "EXPANSION"
    ],
    "tags": [
      "launch",
      "hub"
    ],
    "compatibility": {},
    "effects": {},
    "node_id": "C-05",
    "branch": "C",
    "cost": {
      "chronos_shards": 15,
      "existential_imprints": 0
    },
    "prerequisites": [
      "C-04"
    ],
    "meta_effects": [
      {
        "kind": "stat_bonus",
        "stat": "attack_speed",
        "magnitude": 0.01
      }
    ]
  },
  {
    "category": "meta_node",
    "id": "meta_c_06",
    "schema_version": 1,
    "name_key": "META_C_06_NAME",
    "description_key": "META_C_06_DESC",
    "availability": [
      "LAUNCH",
      "EXPANSION"
    ],
    "tags": [
      "launch",
      "hub"
    ],
    "compatibility": {},
    "effects": {},
    "node_id": "C-06",
    "branch": "C",
    "cost": {
      "chronos_shards": 20,
      "existential_imprints": 0
    },
    "prerequisites": [
      "C-04"
    ],
    "meta_effects": [
      {
        "kind": "option",
        "option_id": "dodge_parry_drill"
      }
    ]
  },
  {
    "category": "meta_node",
    "id": "meta_c_07",
    "schema_version": 1,
    "name_key": "META_C_07_NAME",
    "description_key": "META_C_07_DESC",
    "availability": [
      "LAUNCH",
      "EXPANSION"
    ],
    "tags": [
      "launch",
      "hub"
    ],
    "compatibility": {},
    "effects": {},
    "node_id": "C-07",